KEY,NOTES_FOR_LOCALISATION,LINE_EN,LINE_XX,LINE_FR,LINE_IT,LINE_DE,LINE_ES,LINE_BP,LINE_JP,LINE_RU,LINE_KP,LINE_CN,LINE_XX
$book1_19_page1_3,,The flowers visited by bees will slowly spread and grow!,XX,Les fleurs pollinisées par les abeilles se répandront et se développeront petit à petit !,I fiori visitati dalle api lentamente si espanderanno e cresceranno!,Die von den Bienen besuchten Blumen werden sich langsam ausbreiten und wachsen!,¡Las flores que visiten las abejas se esparcirán y crecerán lentamente!,As flores visitadas por abelhas irão lentamente se espalhar e crescer!,ハチがとまった花はゆっくりと開いて成長するよ！,,,被蜜蜂采过蜜的花朵会慢慢传播和生长!,XX
$book1_19_page1_gp2,,"You can pickup flowers with ③, and place then near your hives for your bees to visit.",XX,Tu peux cueillir des fleurs avec ③ et les placer près de tes ruches pour que tes abeilles les pollinisent.,Puoi raccogliere i fiori con ③ e collocarli vicino ai tuoi alveari affinché le tue api possano impollinarli.,"Du kannst Blumen mit ③ pflücken und sie in der Nähe deiner Bienenstöcke platzieren, damit deine Bienen sie besuchen können.","Puedes recoger flores con ③. Luego, podrás colocarlas cerca de las colmenas para que tus abejas las visiten.","Você pode pegar flores com ③, e colocá-las próximas das suas colmeias para que suas abelhas as visitem.",③で花を拾うことができる。巣の近くに置いてハチが訪れるのを待ってみよう。,,,"你可以用③拾起花朵, 然后放在蜂巢附近, 供你的蜜蜂拜访.",XX
$book1_19_page2_1,,"Later on when you have an Extractor, you'll be able to get flower seeds from your hives based on the flowers they visited.",XX,"Plus tard, quand tu auras un extracteur, tu pourras obtenir des graines de fleurs à partir de tes ruches en fonction des fleurs qu'elles ont pollinisées.","Successivamente, quando avrai un estrattore, potrai ottenere dei semi di fiori direttamente dal tuo alveare a seconda dei fiori che le tue api hanno visitato.","Später, wenn du einen Extraktor hast, kannst du Blumensamen von deinen Bienenstöcken erhalten, die auf den von ihnen besuchten Blumen basieren.","Más tarde, cuando tengas un extractor, podrás recoger semillas de flores de tus panales según las flores que hayan visitado las abejas.","No futuro, quando tiver um Extrator, você conseguirá pegar sementes de flores nas suas colmeias, baseado em quais flores elas visitaram.",そのうち抽出器が手に入って、ハチがこれまでに止まった花の種を巣から収穫できるようになるよ。,,,"之后, 等你有了抽取器, 你就能获得蜜蜂们拜访过的花的种子.",XX
$book1_19_page2_2,,"You'll even be able to discover new 'hybrid' flowers that can have direct effects on nearby bees, such as increasing their productivity or allowing them to stay up at night!",XX,Tu pourras même découvrir de nouvelles fleurs hybrides qui peuvent avoir des effets directs sur les abeilles voisines. Par exemple en augmentant leur productivité ou en leur permettant de rester éveillées la nuit !,"Potrai persino scoprire nuovi fiori 'ibridi' che potranno avere degli effetti diretti sulle api vicine. Per esempio, potranno incrementare la loro produttività o permettere loro di restare sveglie di notte!","Du kannst sogar neue, 'hybride' Blumen entdecken, die sich direkt auf die Bienen in der Nähe auswirken können, z. B. indem sie ihre Produktivität steigern oder es ihnen ermöglichen, nachts wachzubleiben!","Hasta podrás descubrir nuevas flores, 'híbridas', que pueden tener efectos sobre las abejas cercanas. ¡Hablamos de cosas como mejor productividad o actividad nocturna!","Você até mesmo irá descobrir novas flores 'híbridas' que podem causar efeitos imediatos nas abelhas próximas, como aumento de produtividade ou permitir que fiquem acordadas durante a noite!",新種の「ハイブリッド」の花なんかも存在するよ。近くの巣の生産性を上げたりとか、夜でも巣が稼働するような効果を与えることができるんだ！,,,"你甚至可以发现新的'杂交'花, 这种花可以对附近的蜜蜂产生直接影响, 比如提高它们的生产力, 或是让它们熬夜工作!",XX
$book1_20_id,,Beekeeping 101,XX,B.a.-ba de l'apiculture,Apicoltura di base,Imkerei-Grundkurs,ABC de la apicultura,Apicultura básica,養蜂 101,,,养蜂 101,XX
$book1_20_page1_1,,"Now you have some bees and a Beehive, you can start breeding bees!",XX,"Maintenant que tu as des abeilles et une ruche, tu peux commencer à élever des abeilles !","Ora che hai delle api e un alveare, puoi iniziare a incrociare le api!","Jetzt, wo du einige Bienen und einen Bienenstock hast, kannst du anfangen, Bienen zu züchten!","Ahora que tienes algunas abejas y una colmena, ¡es hora de empezar a reproducir abejas!","Agora que você tem abelhas e uma Colmeia, você pode começar a criar abelhas!",ハチと巣を手に入れたら、ハチの飼育を始めよう！,,,"现在你已经有了蜜蜂和蜂巢, 可以开始繁殖蜜蜂啦!",XX
$book1_20_page1_2,,"To breed bees, place two bees in the left-hand input slots of a hive to create a Queen.",XX,"Pour élever des abeilles, place deux abeilles dans les emplacements de gauche d'une ruche pour créer une reine.","Per incrociare le api, collocane due negli slot di sinistra di un alveare per creare una regina.","Um Bienen zu züchten, setze zwei Bienen in den linken Eingabebereich eines Bienenstocks, um eine Königin zu erzeugen.","Para ello, coloca dos abejas en los espacios de entrada a la izquierda de una colmena para crear una reina.","Para cruzar abelhas, coloque duas nos espaços de entrada a esquerda de uma colmeia para criar uma Rainha",飼育するには、左側投入スロットに2匹のミツバチを投入して女王バチを育てよう。,,,"想要开始繁殖工作, 把两只蜜蜂放到蜂巢左侧的输入槽位来培育出蜂后.",XX
$book1_20_page2_1,,The Queen will then get to work and start producing Honeycomb. At the end of her lifespan she'll produce cute lil offspring!,XX,"La reine se mettra alors au travail et commencera à produire des rayons de miel. À la fin de sa vie, elle produira une jolie petite progéniture !","La regina si metterà al lavoro e inizierà a produrre i favi. Alla fine del suo ciclo di vita, produrrà della tenerissima prole!",Die Königin macht sich dann an die Arbeit und beginnt mit der Produktion von Honigwaben. Am Ende ihrer Lebensspanne wird sie süße kleine Nachkommen produzieren!,"A continuación, la reina se pondrá manos a la obra y empezará a producir panales. Hacia el final de su vida, ¡producirá unas crías muy bonitas!",A Rainha então irá começar a produzir Favos. No final do seu ciclo de vida ela dará luz a pequeninas proles!,女王バチが働くとハニカムを生産し始める。寿命を終えるときに小さくてかわいい子孫を残すよ！,,,"蜂后会开始工作并生产蜂窝. 在寿命即将结束时, 她会产下可爱的后代!",XX
$book1_20_page2_2,,All bees produced in natural Beehives will be direct clones of the Queen! Time to make an army of Beeatrices.,XX,Toutes les abeilles produites dans des ruches naturelles seront des clones directs de la reine ! Il est temps de former une armée de Beillatrices.,Tutte le api nate in alveari naturali saranno diretti cloni della regina! È ora di creare un esercito di Melisse!,"Alle in natürlichen Bienenstöcken erzeugten Bienen werden direkte Klone der Königin sein! Zeit, eine Armee von Bienatricen zu schaffen.",¡Las abejas criadas en colmenas naturales serán clones directos de la reina! Es hora de amasar un ejército de Abelinas.,Todas as abelhas produzidas em Colmeias naturais serão clones da Rainha! Hora de montar um exército de Melissas.,天然の巣から捕獲できるミツバチは直接女王バチに育成できる！ハッチをたくさん育成して編成を組もう！,,,所有天然蜂巢中产出的蜜蜂后代都会是蜂后的克隆体! 来打造一支蜜阿特丽斯军队吧.,XX
$book1_21_id,,Pimp My Hive,XX,Pimp ma ruche,Attivare l'alveare,Pimp my Bienenstock,Enchúlame la colmena,Incrementando colmeias,巣の効率化,,,高效蜂巢,XX
$book1_21_page1_1,,Now Honeycomb is delicious and crunchy (stop eating it all!) but there's far more useful things your bees could be producing!,XX,Les rayons de miel sont délicieux et croustillants (arrête de tout manger !) mais il y a des choses bien plus utiles que tes abeilles pourraient produire !,"Certo, i favi sono deliziosi e croccanti (ma smettila di mangiarli tutti!), ma ci sono cose molto più utili che le tue api potrebbero produrre!","Honigwaben sind köstlich und knusprig (hör auf, alle zu essen!), aber es gibt weitaus nützlichere Dinge, die deine Bienen produzieren könnten!","Los panales con miel son deliciosos y crujientes, sí, ¡pero ya deja de comértelos! Ahora bien, ¡tus abejas pueden producir aún más cosas!","Favos são deliciosos e crocantes (pare de comer todos!), mas tem muitas outras coisas úteis que suas abelhas poderiam produzir!",ハニカムって噛み応えが合っておいしいよね（全部は食べないでよ！）、ハチの生産物にはもっと便利なものがあるよ。,,,"虽然蜂窝美味又松脆(别吃光啦!), 但其实你的蜜蜂还可以生产更多有用的东西!",XX
$book1_21_page1_2,,For that you'll need to create your first proper Apiary out of wood and some of that honeycomb you've been making.,XX,"Pour ça, il va te falloir créer ton premier véritable rucher à base de bois et d'un peu de ce rayon de miel que tu as fabriqué.","Prima di tutto, dovrai creare il tuo primo apario; usa del legno e un po' del favo che stai fabbricando.",Dafür musst du deinen ersten richtigen Bienenstock aus Holz und ein paar von den Honigwaben bauen.,"Para lograrlo, tendrás que crear tu primer apiario; necesitarás un poco de madera y algunos de esos panales que hiciste.",Primeiro você vai precisar criar um Apiário com madeira e alguns dos favos que tem feito.,まず木材やハニカムを使ってちゃんとした養蜂場を作ろう。,,,"为此, 你需要用木材和一直以来生产的蜂窝来打造你的第一个养蜂场.",XX
$book1_21_page1_3,,Once you have one you'll be able to use Hive Frames for gathering produce from your bees.,XX,"Une fois que tu en auras un, tu pourras utiliser les cadres de ruche pour récolter la production de tes abeilles.","Una volta ottenuto, sarai in grado di utilizzare dei telai per raccogliere la produzione delle tue api.",Sobald du einen hast kannst du die Rähmchen zum Sammeln der Produkte deiner Bienen verwenden.,"Cuando tengas un apiario, podrás usar cuadros para recolectar la producción de tus abejas.","Depois disso, você poderá usar Quadros de Colmeia para coletar produtos das suas abelhas.",養蜂場が作れたら、巣のフレームを使ってハチの生産物を収集できるよ。,,,"养蜂场制造完成后, 你就可以用巢框来收集蜜蜂的产物.",XX
$book1_21_page2_1,,"Plus with an Apiary you'll not only be able to get different and more valuable produce, but you'll also be able to start cross-breeding different bee species and start discovering new ones!",XX,"De plus, avec un rucher, tu pourras non seulement obtenir des produits plus variés et précieux, mais aussi commencer à croiser différentes espèces d'abeilles et en découvrir de nouvelles !","In più, con un apiario, non sarai solamente in grado di ottenere prodotti vari e di maggior valore, ma potrai cominciare anche a incrociare diverse specie di api e iniziare a scoprirne di nuove!","Und mit einem eigenen Bienenstock kannst du nicht nur verschiedene und wertvollere Produkte erzeugen, sondern auch verschiedene Bienenarten kreuzen und neue Arten entdecken!","Además, con un apiario no solo conseguirás productos diferentes y más valiosos, ¡sino que también podrás entrecruzar diferentes especies para descubrir otras nuevas!","Além de conseguir coletar produtos diferentes e valiosos com seu Apiário, você também encontrará novas espécies de abelhas fazendo cruzamentos interespécies!",養蜂場があると色々と価値の高い生産物が手に入るだけじゃなくて、異なる種を交配して新種の発見だってできるよ！,,,"另外, 你不仅可以从养蜂场得到各种各样更有价值的产品, 还可以用它来杂交培育不同的蜂种, 并发现新型的蜜蜂!",XX
$book1_22_id,,What's In The Box,XX,Y'a quoi dans cette boîte ?,Cosa c'è nella scatola,Was ist in der Box?,¿Qué hay en la caja?,O que tem na caixa,箱の中身はなんだろな,,,盒子里是什么,XX
$book1_22_page1_1,,I'm betting at this point every crate you own is brimming with bees!!,XX,"Je parie qu'à ce stade, tous tes coffres grouillent d'abeilles !",Scommetto che a questo punto ogni cassa in tuo possesso grondi letteralmente di api!,"Ich wette, zu diesem Zeitpunkt ist jede Kiste, die du besitzt, voll mit Bienen!!",¡Seguro que todas tus cajas están repletas de abejas!,Aposto que agora todas as suas caixas estão lotadas de abelhas!!!,そろそろキミの木箱はハチで溢れかえっているんじゃないかな！,,,我敢打赌现在你每个箱子里都装满了蜜蜂!,XX
$book1_22_page1_2,,"While good for storing your items, they're not the most efficient way to store bees...",XX,"Bien qu'ils permettent de ranger tes objets, ce n'est pas le moyen le plus efficace de stocker les abeilles...","Anche se sono un buon modo per conservare gli oggetti, le casse non sono ideali per riporre le api...","Sie eignen sich zwar gut zur Aufbewahrung von Gegenständen, sind aber nicht die effizienteste Art, Bienen zu lagern ...","Si bien son ideales para guardar objetos, no son la forma más eficiente de alojar a tus abejas...","Apesar de serem boas para guardar itens, não são o jeito mais eficiente de guardar abelhas.",アイテムを保管するにはいいけど、ハチの保管にはもっといい方法がありそう...,,,"虽然箱子确实是用来储存东西的, 但不是保存蜜蜂最高效的办法...",XX
$book1_22_page1_3,,"Beeboxes can be used to store an unlimited amount of a single species, neatly sorted based on their traits.",XX,"Les boîtes à abeilles peuvent être utilisées pour stocker une quantité illimitée d'une seule espèce, soigneusement classées en fonction de leurs caractéristiques.","Puoi usare le scatole per api per conservare un numero illimitato di esemplari di una singola specie, ordinandole comodamente per caratteristiche.","In Bienenkästen kann eine unbegrenzte Anzahl von Bienenarten aufbewahrt werden, ordentlich sortiert nach ihren Merkmalen.","Las cajas para abejas se usan para albergar una cantidad ilimitada de abejas de una única especie, organizadas según sus rasgos.","Caixas de abelha podem ser usadas para guardar um número ilimitado de uma única espécie, organizadas por suas características.",ハチ用箱を使えば1種類のハチを無限に収容できたり、特徴ごとに整頓して管理できるよ。,,,"蜂盒可以用来保存无限数量的单一种类蜜蜂, 并根据其特性进行分类.",XX
$book1_22_page2_1,,"To withdraw a bee just select its storage icon and you'll be able to take out any queens, bees, or blessed bees of that type.",XX,"Pour retirer une abeille, il suffit de sélectionnez sur son icône de stockage et tu pourras retirer les reines et les abeilles de ce type.","Per ritirare un'ape, seleziona sua icona di stoccaggio e sarai in grado di tirar fuori qualsiasi regina, ape comune o ape benedetta di quel tipo.","Um eine Biene zu entnehmen, auswählen Sie einfach auf ihr Vorratssymbol und du kannst alle Königinnen, Drohnen oder gesegneten Bienen dieser Art entnehmen.","Para retirar a una abeja, seleccione en su ícono en la caja; a continuación, podrás retirar a cualquier reina, abeja normal o bendita de ese tipo.","Para retirar uma abelha é só selecionar no ícone do armazém e você poderá pegar rainhas, abelhas ou abelhas abençoadas daquele tipo.",ハチを取り出すには保管アイコンをクリックするだけ。女王バチ、ミツバチ、幸運のハチ...何でも取り出せるよ。,,,"想要取出一只蜜蜂, 只需选择它的存储图标, 你就能取出这种类型下的任意蜂后, 蜜蜂或是受祝福的蜜蜂.",XX
$book1_23_id,,Crossbreeding,XX,Croisements,Ibridazione,Kreuzen,Cruzamiento,Cruzamento,交配,,,杂交繁育,XX
$book1_23_page1_1,,"Now you have an Apiary, you'll be able to start cross-breeding!",XX,"Maintenant que tu as un rucher, tu vas pouvoir commencer à croiser des espèces !","Ora che hai un Apiario, puoi iniziare con l'ibridazione!","Da du nun einen Bienenstock hast, kannst du mit dem Kreuzen anfangen!","Ahora que tienes un apiario, ¡puedes empezar a cruzar especies!","Agora que você tem um Apiário, poderá começar a fazer cruzamentos interespécies!",養蜂場ができたら、交配を始めてみよう！,,,"有了养蜂场, 现在你可以开始杂交繁育了!",XX
$book1_23_page1_2,,"When you create a Queen in an Apiary it will inherit a selection of traits from both bees, and can become a hybrid!",XX,"Lorsque tu crées une reine dans un rucher, elle hérite d'une sélection de caractéristiques des deux abeilles, et peut devenir un hybride !","Quando crei una regina in un apiario, essa erediterà una selezione di tratti da entrambe le api e potrà diventare un ibrido!","Wenn du eine Königin in einem Bienenstock erschaffst, erbt sie eine Auswahl an Eigenschaften von beiden Drohnen und kann zu einem Hybriden werden!","Cuando creas una reina en un apiario, esta heredará una selección de rasgos de ambas abejas, ¡y hasta puede resultar una especie híbrida!","Quando você cria uma Rainha em um Apiário, ela irá herdar uma série de características de ambas as abelhas, e poderá se tornar uma híbrida!",養蜂場で女王バチを生産すると元のミツバチから特徴が引き継がれてハイブリッド種になるよ！,,,"当你在养蜂场里培育蜂后时, 它会从两只蜜蜂中各继承一部分特征, 从而变成杂交种!",XX
$book1_23_page1_3,,Craft a Predictor to help predict offspring traits!,XX,Fabrique un prédicteur pour t'aider à prédire les caractéristiques de ta progéniture !,Fabbrica un predittore che possa aiutarti a predire le caratteristiche della prole!,"Baue einen Vorhersager, um die Eigenschaften der Nachkommen vorherzusagen!",¡Crea un pronosticador para ayudarte a predecir los rasgos de las crías!,Crie um Preditor para te ajudar a prever as características da prole!,予測器をクラフトして生産するハチの特徴を予測しよう！,,,制造预测器来预测后代的特性!,XX
$book1_23_page2_1,,Hybrid Queens have a chance that their offspring will mutate and become a completely new species.,XX,Les reines hybrides ont une chance que leur progéniture mute et devienne une espèce entièrement nouvelle.,Le regine ibride hanno una possibilità che la loro prole muti e diventi una specie completamente nuova.,"Bei Hybridköniginnen besteht die Möglichkeit, dass ihre Nachkommen mutieren und zu einer völlig neuen Art werden.",Las reinas híbridas tienen una probabilidad de producir crías que mutarán y se convertirán en una especie completamente nueva.,Rainhas híbridas tem uma chance de que sua prole sofra mutações e vire uma nova espécie.,ハイブリッド種の女王バチが産む子バチは変異する可能性があり、完全な新種を生み出すかもしれない。,,,"杂交蜂后产下的后代有几率发生变异, 成为一个全新的蜂种.",XX
$book1_23_page2_2,,To get started cross-breed a 'Common' and 'Forest' bee together into a 'Common-Forest' Queen and see if you can get a 'Verdant' species as one of the offspring!,XX,"Pour commencer, croise une abeille « commune » et une abeille « forestière » pour former une reine « commune-forestière ». Une abeille « verdoyante » fera sans doute partie de sa descendance !","Per iniziare, incrocia un'ape 'comune' e una 'silvestre' in una regina 'comune-silvestre' e cerca di produrre una specie 'verdeggiante' come prole!","Um den Anfang zu machen, kreuze eine 'Gemeine' und eine 'Wald'-Biene zu einer 'Gemeine-Wald'-Königin und schau, ob du eine Grünschnabel-Spezies als Nachkommen erhältst.","Para empezar, cruza una abeja 'común' con una 'forestal' para crear una reina 'común-forestal'. ¡A ver si consigues que una de las crías sea de la especie 'aguamarina'!",Para começar os cruzamentos interespécies junte uma 'Comum' e uma 'Silvestre' para fazer uma Rainha 'Comum-Silvestre' e veja se consegue uma prole 'Verdejante'!,ミツバチと森林ミツバチを交配させると混合の女王バチが産まれる。ミツバチ混合種が手に入るかもしれないよ！,,,"先把'普通'蜜蜂和'森林'蜜蜂杂交繁育成'普通森林'蜂后, 然后看看后代中会不会出现'新绿'蜜蜂!",XX
$book1_24_id,,Uncapping Frames,XX,Désoperculation des cadres,Disopercolatura dei telai,Rähmchen aufschaben,Destapar cuadros,Abrindo Quadros,フレームに空きスペースを作る,,,巢框除盖,XX
$book1_24_page1_1,,"Instead of making honeycomb, bees in an Apiary will slowly fill up any frames you've put inside instead. When filled, you'll need to uncap the frame before you can extract any of the goodies inside.",XX,"Au lieu de fabriquer des rayons, les abeilles du rucher vont remplir lentement les cadres que tu as placés. Une fois remplis, il te faudra désoperculer le cadre avant de pouvoir extraire ce qu'il contient.","Invece di formare favi, le api in un apiario riempiranno lentamente ogni telaio da te installato. Una volta pieno, dovrai disopercolare il telaio prima di poter estrarre il suo contenuto.","Anstatt Waben zu produzieren, füllen die Bienen in einem Bienenstock langsam die Rähmchen, die du hineingestellt hast. Wenn die Rähmchen gefüllt sind, musst du sie abschaben und dadurch öffnen, bevor du die darin enthaltenen Leckereien entnehmen kannst.","En vez de construir panales, las abejas de un apiario llenan lentamente los marcos que coloques dentro. Una vez que estén llenos, tendrás que destaparlos para extraer los manjares que tengan dentro.","Ao invés de formar favos, abelhas num Apiário lentamente irão preencher os quadros que você colou dentro. Quando preenchidos, você irá precisar abrir o quadro antes de poder extrair seus tesouros.",ハニカムを作っていくと、養蜂場のフレームはいっぱいになってくる。満タンになったら、巣の生産物を抽出する前にフレームに空きスペースを作ろう。,,,"养蜂场中的蜜蜂不会做蜂窝, 而是会慢慢填满你放进去的巢框. 巢框满了以后, 你需要给巢框除盖, 然后才能抽取里面的好东西.",XX
$book1_24_page1_2,,"Craft an Uncapping Bench and open it up, place a filled frame on any of the left-side input slots and you'll see another ◍ handle appear!",XX,"Fabrique un banc de désoperculation et ouvre-le. Place un cadre plein sur l'un des emplacements du côté gauche, tu verras alors apparaître une autre poignée ◍ !",Costruisci un 'banco da disopercolazione' e aprilo. Posiziona un telaio opercolato in uno degli slot di sinistra e vedrai apparire un altro manico ◍!,Stelle eine Werkbank zur Aufschabung her und öffne sie. Lege ein gefülltes Rähmchen auf einen der Eingabebereiche auf der linken Seite und du wirst einen weiteren ◍ Griff erscheinen sehen!,"Crea una mesa de destape, ábrela y coloca un marco lleno en cualquiera de los espacios de entrada de la izquierda. ¡Verás que aparece otro mango ◍!","Crie uma Mesa de Desoperculação e abra-a, coloque o quadro cheio em um dos espaços de entrada da esquerda, e você verá outro ◍ cabo aparecer!",スペース製造台をクラフトして開き、左側の投入スロットにいっぱいになったフレームを投入しよう。◍ハンドルが出てくるよ！,,,"制造一个除盖台并将其打开, 把已满巢框放在左侧任意输入槽位, 然后你会发现, 又出现了一个◍把手!",XX
$book1_24_page2_1,,"Drag the handle down to uncap your frames, you'll need 3 scrapes per frame.",XX,Fais glisser la poignée vers le bas pour désoperculer tes cadres. Chaque cadre nécessite 3 grattages.,Tira il manico in basso per disopercolare i telai. Avrai bisogno di 3 raschiature per telaio.,"Ziehen Sie den Griff nach unten, um die Rähmchen aufzuschaben. Du brauchst drei Runden pro Rähmchen.",Arrastra el mango hacia abajo para destapar los cuadros. Necesitarás tres raspados por cuadro.,"Puxe o cabo para baixo para abrir seus quadros, você vai precisar de 3 raspagens por quadro.",ハンドルを下にドラッグしてフレームに空きスペースを作ろう。1フレームにつき3つの木箱が必要だよ。,,,"向下拖动把手来给巢框除盖, 每个巢框需要刮3次.",XX
$book1_24_page2_2,,You'll also get some nice goopy Propolis which we'll be needing later!,XX,Tu obtiendras également de la propolis bien gluante dont on aura besoin plus tard !,Otterrai anche della appiccicosissima propoli che ti sarà utile più tardi.,"Du bekommst auch etwas Schönes: klebriges Propolis, das wir später noch brauchen werden!",¡También recibirás un poco de propóleo viscoso que necesitaremos más tarde!,"Com isso você também irá conseguir um pouco de Própolis pegajoso, que iremos usar depois!",ベタついたプロポリスも手に入るよ。後で必要になるからね！,,,"你还会得到漂亮的蜂胶, 之后会用到!",XX
$book1_25_id,,Extracting Honey,XX,Extraction du miel,Estrazione del miele,Honig extrahieren,Extraer miel,Extraindo Mel,ハチミツの抽出,,,抽取蜂蜜,XX
