KEY,NOTES_FOR_LOCALISATION,LINE_EN,LINE_XX,LINE_FR,LINE_IT,LINE_DE,LINE_ES,LINE_BP,LINE_JP,LINE_RU,LINE_KP,LINE_CN,LINE_XX
$book1_30_page2_1,,"Heaters let you ramp up the temperature by burning logs and sawdust bricks, whereas Coolers let you cool down the area using snow.",XX,"Les chauffages permettent d'augmenter la température en brûlant des bûches et des briques de sciure, tandis que les refroidisseurs permettent de refroidir la zone à l'aide de neige.","I riscaldatori ci permettono di far aumentare la temperatura bruciando tronchi e mattoni di segatura, mentre i raffreddatori permettono di rinfrescare l'area usando la neve.","Mit Heizern kannst du die Temperatur durch das Verbrennen von Holzstämmen und Sägemehlziegeln erhöhen, während du mit Kühlern den Bereich mit Schnee abkühlen kannst.","Los calentadores te permiten subir la temperatura quemando troncos y ladrillos de aserrín, mientras que los enfriadores usan nieve para enfriar la zona.","Aquecedores permitem que suba a temperatura queimando troncos e tijolos de serragem, e Resfriadores permitem que resfrie a área usando neve.",ヒーターを使えば丸太やおがくずのレンガを燃やして気温を上げられると、クーラーを使えば雪で辺りの気温を下げられる。,,,加热器可以通过燃烧原木和锯末砖来提高温度；冷却机则可以用雪冷却周围区域.,XX
$book1_31_id,,Smokey Eyes,XX,Fumées parfumées,Fumo negli occhi,Das Rauch noch!,Humo en los ojos,Olhos enfumaçados,曇った視界,,,烟雾缭绕,XX
$book1_31_page1_1,,In the swamps you may have noticed the bees are a bit more grumpy and won't let you in their hives!,XX,"Dans les marais, tu as peut-être remarqué que les abeilles sont un peu plus grognonnes et ne te laissent plus approcher leurs ruches !",Potresti aver notato che nelle paludi le api sono un po' più scontrose e non ti lasciano avvicinare ai loro alveari!,"In den Sümpfen hast du vielleicht bemerkt, dass die Bienen etwas mürrischer sind und dich nicht in ihre Bienenstöcke lassen!","Quizás hayas visto, en los pantanos, que las abejas son un poco más cascarrabias ¡y no te permiten entrar a sus colmenas!","Você deve ter percebido que nos pântanos as abelhas são um pouquinho mal-humoradas, e não vão te deixar chegar perto de suas colmeias!",湿地に生息するハチはちょっと気性が荒くて巣に入らせてくれないかもしれない！,,,"你在沼泽中可能会遇到一些脾气很暴躁的蜜蜂, 它们不会让你靠近蜂巢!",XX
$book1_31_page1_2,,"Certain species, like those found in the swamps, need to be calmed before they can be approached or used to work in Apiaries.",XX,"Certaines espèces, comme celles que l'on trouve dans les marais, doivent être calmées avant de pouvoir être approchées ou utilisées pour travailler dans les ruchers.","Certe specie, come quelle che trovi nelle paludi, vanno calmate prima di poter essere avvicinate o poter essere usate negli apiari.","Bestimmte Arten, wie die in den Sümpfen vorkommenden, müssen beruhigt werden, bevor man sich ihnen nähern oder sie für die Arbeit in Bienenstöcken einsetzen kann.","Tendrás que tranquilizar a algunas especies, como las que se encuentran en el pantano, antes de que puedas acercarte o ponerlas a trabajar en un apiario.","Algumas espécies, como essa dos pântanos, precisam ser acalmadas antes de você poder se aproximar, ou colocar para trabalhar em Apiários.",湿地で発見されるような特定の種には、近づく前や養蜂場で働かせる前に落ち着かせる必要がある。,,,"像这样的蜂种, 需要先对其进行安抚, 然后才能靠近它们或是把它们放入养蜂场工作.",XX
$book1_31_page1_3,,"To calm down bees you'll need to get your hands on a Smoker, which uses Sawdust and Flowers to create scented smoke.",XX,"Pour apaiser les abeilles, tu dois mettre la main sur un enfumoir, qui utilise de la sciure de bois et des fleurs pour former une fumée parfumée.","Per calmare le api dovrai mettere le mani su un affumicatore, che usa segatura e fiori per creare del fumo profumato.","Um die Bienen zu beruhigen, brauchst du einen Smoker, der aus Sägemehl und Blumen duftenden Rauch erzeugt.","Para calmara a las abejas, tendrás que conseguir un ahumador, que usa aserrín y flores para crear un humo perfumado.","Para acalmar abelhas, você irá precisar de um Fumigador, que usa Serragem e Flores para criar uma fumaça aromática.",ハチを落ち着かせるにはおがくずや花から生成された煙が出てくる燻煙器に手を当ててみよう。,,,"为了让蜜蜂安静下来, 你需要一个喷烟器. 它会使用锯末和花来生成有香味的烟雾.",XX
$book1_31_page1_4,,Different species prefer different scents!,XX,Chaque espèce a son parfum préféré !,Specie differenti prediligono profumi differenti!,Verschiedene Arten bevorzugen unterschiedliche Düfte!,¡Cada especie prefiere un aroma distinto!,Espécies diferentes preferem aromas diferentes!,ハチには好みの香りがある！,,,不同的蜂种喜好的气味也不同!,XX
$book1_31_page2_1,,Beenjamin in town will sell you one when you can prove you're an experienced enough Beekeeper!,XX,"En ville, Hippollen te vendra un enfumoir si tu prouves que tu as suffisamment d'expérience !","In città, Favino te ne venderà uno quando dimostrerai di aver acquisito una certa esperienza nell'apicoltura!","Bienjamin in der Stadt wird dir einen verkaufen, wenn du nachweisen kannst, dass du ein erfahrener Imker bist!",¡Cada especie prefiere un aroma distinto! ¡Abenjamín te venderá un ahumador para que demuestres que eres una eminencia de la apicultura!,"Na cidade, o Benjamel pode te vender um, se você provar que é experiente em apicultura!",街にいる蜂ノ宮博士に養蜂家としての経験をアピールできたらひとつ打ってくれるよ！,,,"等你能证明自己是一个经验丰富的养蜂人的时候, 镇上的本杰蜜就会卖一个喷烟器给你!",XX
$book1_32_id,,Tapping Trees,XX,Incision des arbres,Resina degli alberi,Bäume anzapfen,La resina de los árboles,Furando Árvores,木から樹脂を採る,,,自来树脂,XX
$book1_32_page1_1,,What's brown and sticky?,XX,Qu'est-ce qui est marron et collant ?,Cos'è marrone e appiccicoso?,Was ist braun und klebrig?,¿Qué es pegajoso y de color marrón?,O que é marrom e melado?,茶色くてベタベタしたものってなんだ？,,,什么东西是棕色的还黏黏的?,XX
$book1_32_page1_2,,Well... okay yeah I guess so but I was thinking more about Tree Resin!,XX,"Bon... oui, je suppose que oui, mais je pensais plutôt à la résine d'arbre !","Beh, ok, in effetti hai ragione! Ma in realtà io pensavo alla resina degli alberi!","Jaaaah, ähm, das auch. Aber ich dachte eher an Baumharz!","Bueno, sí, supongo que sí... ¡Pero yo estaba pensando en la resina de los árboles!","Tá... Ok, justo, mas eu estava pensando em Resina de Árvore!",そうだよね...それもあるかもしれないけど、今言っていたのは樹脂のことかな！,,,"呃...也对吧, 不过其实我想说的是树脂啦!",XX
$book1_32_page1_3,,Collecting Resin from Trees will let you infuse your wood to make it more versatile and last longer for Beekeeping purposes.,XX,La collecte de résine sur les arbres permet d'infuser le bois pour le rendre plus souple et augmenter sa durabilité.,Raccogliere la resina dagli alberi ti permetterà di infondere il legno per renderlo più versatile e resistente per l'apicoltura.,Durch das Sammeln von Baumharz kannst du dein Holz für die Imkerei vielseitiger und langlebiger machen.,"La resina te permitirá infusionar la madera para hacerla más versátil y darle mayor durabilidad. Todo esto con propósitos apícolas, claro.","Coletar Resina de Árvores vai permitir que infunda sua madeira, tornando-a mais versátil e resistente para propósitos de Apicultura.",木から樹脂を採収すると木材を加工できるから、色んな事に使えるようになったり丈夫になったりして養蜂に役立つよ。,,,"从树上收集树脂后可以注入木头来使其功能更丰富, 也更强韧, 从而使养蜂工作更有效率.",XX
$book1_32_page1_4,,To get Resin from a Tree you'll need to craft a 'Treetap'.,XX,"Pour obtenir de la résine d'un arbre, il faut fabriquer un « inciseur ».",Per ottenere della resina da un albero dovrai creare un 'rubinetto per alberi'.,"Um Harz aus einem Baum zu gewinnen, musst du einen 'Anzapfer' herstellen.","Para obtener la resina de un árbol, tendrás que crear un 'grifo de árbol'.","Para pegar Resina de uma Árvore, você precisar criar uma 'Torneirinha'.",木から樹脂を搾り取るには「木に付ける蛇口」をクラフトしよう。,,,"想要收集树脂, 你需要制造一个'树龙头'.",XX
$book1_32_page1_5,,You can use a Treetap by equipping it and clicking on a Tree with ▵.,XX,Tu peux utiliser un inciseur en l'équipant et en cliquant sur un arbre avec ▵.,Puoi usare un rubinetto per alberi equipaggiandolo e cliccando su un albero con ▵.,"Du kannst einen Anzapfer benutzen, indem du ihn ausrüstest und mit ▵ auf einen Baum klickst.","Para usar un grifo de árbol, equípalo y haz clic en un árbol con ▵.",Você pode usar a Torneirinha equipando-a e clicando numa Árvore com ▵.,蛇口を装備して▵で木をクリックしよう。,,,装备树龙头并对一棵树按▵就可以使用了.,XX
$book1_32_page1_gp5,,You can use a Treetap by equipping it and using it on a Tree with ③.,XX,Tu peux utiliser un inciseur en l'équipant et en l'utilisant sur un arbre avec ③.,Puoi usare un rubinetto per alberi equipaggiandolo e usandolo su un albero con ③.,"Du kannst einen Anzapfer benutzen, indem du ihn ausrüstest und ③ auf einem Baum verwendest.","Para usar un grifo de árbol, equípalo y úsalo en un árbol con ③.",Você pode usar a Torneirinha equipando-a e usando-o numa Árvore com ③.,蛇口を装備して③で木につけてみよう。,,,装备树龙头并对一棵树按③就可以使用了.,XX
$book1_32_page2_1,,This will 'Tap' the Tree and start automatically gathering Resin for you that you can drain into canisters.,XX,Tu pourras ainsi exploiter l'arbre et commencer à recueillir automatiquement de la résine qui s'accumulera dans des boîtiers.,In questo modo 'forerai' l'albero e inizierai a ottenere automaticamente della resina che riemperà i tuoi contenitori.,"Dadurch wird der Baum 'angezapft' und beginnt automatisch, Harz für dich zu sammeln, das du in Kanister ablassen kannst.","Esto hará una incisión en el árbol, y el grifo empezará a recoger la resina, que podrás colocar dentro de latas.","Assim você irá 'Furar' a Árvore e automaticamente coletará Resina, que você pode drenar para galões.",木に蛇口をつけられたらどんどん樹脂が出てきて、容器に溜められるよ。,,,"这样就可以自动收集树里流出来的'自来'树脂, 然后全部排入罐里.",XX
$book1_32_page2_2,,Once a Tree is empty of Resin you won't be able to tap it again - all good things must come to an end!,XX,"Une fois un arbre vide de résine, il n'est plus exploitable. Toutes les bonnes choses ont une fin !","Una volta che l'albero è svuotato di tutta la resina, non potrai più sfruttarlo. Tutte le cose buone finiscono!","Sobald ein Baum kein Harz mehr enthält, kannst du ihn nicht mehr anzapfen - man soll aufhören, wenns am klebrigsten ist!","Cuando un árbol se quede sin resina, ya no podrás seguir extrayéndola. Así es: ¡todo concluye al fin, nada puede escapar!","Quando uma Árvore ficar esgotada de Resina, você não poderá mais furá-la. Tudo que é bom chega ao fim!",樹脂が完全に搾り取られた木からはもう樹脂は採れないよ - いい物には終わりがある！,,,"当一棵树已经没有树脂的时候, 你就无法继续提取了 - 天下没有不散的宴席!",XX
$book1_33_id,,"It Rains, It Pours",XX,Il pleut il mouille...,"Quando piove, diluvia!",Es regnet seinen Lauf,Llueve a cántaros,Chove sem parar,雨が降れば、溜めよう,,,淅淅蜜蜜,XX
$book1_33_page1_1,,Don't you just love the rain? No? Oh well bad news about this chapter I'm afraid!,XX,"J'espère pour toi que tu aimes la pluie, car dans ce chapitre ça va pas venir à manquer !","Non adori anche tu la pioggia? Ah, no? Oh, questo capitolo non ti piacerà, allora.","Liebst du nicht auch den Regen? Nein? Tja, schlechte Nachrichten für dieses Kapitel, fürchte ich!","¿No te encanta la lluvia? ¿No? Ah, bueno, ¡me temo que te tengo malas noticias sobre este capítulo!","Quem é que não gosta de uma chuvinha, né? Não? Sinto muito, mas esse capítulo é sobre isso!",雨は好き？あんまり？あぁ、この章は向いてないかも、ごめんね！,,,"难道你不爱下雨天吗? 不喜欢? 噢, 那这一章你可能也不会喜欢了!",XX
$book1_33_page1_2,,"As you might have realised, not all bees like the rain - but some bees love it! It's also a really useful source of water, if only we had a way to collect it though...",XX,"Comme tu l'as peut-être compris, toutes les abeilles n'aiment pas la pluie, mais certaines en raffolent ! C'est aussi une source d'eau très utile. Si seulement on avait un moyen de la recueillir...","Come avrai già capito, non a tutte le api piace la pioggia - ma qualche specie la adora! È davvero un'utilissima fonte d'acqua, se solo avessimo un modo per raccoglierla...","Wie du vielleicht schon bemerkt hast, mögen nicht alle Bienen den Regen - aber manche lieben ihn! Er ist auch eine wirklich nützliche Wasserquelle, wenn wir nur eine Möglichkeit hätten, ihn zu sammeln...","Como te habrás dado cuenta, no a todas las abejas les gusta la lluvia, ¡pero a algunas les encanta! También es una buena fuente de agua. Si tan solo pudiéramos recolectarla...","Já deve ter visto que nem todas as abelhas gostam da chuva... mas algumas amam! Também é uma ótima fonte de água, imagina se tivesse um jeito da gente captar...",もう気づいているだろうけど、ハチはみんな雨が好きってわけではない - でも好きなハチだっているんだ！すごく便利な水源だしね、溜めておく方法があればだけど...,,,"你应该也发现了, 并非所有蜜蜂都喜欢下雨 - 但有的蜜蜂超爱雨天! 同时, 雨水也是非常有用的水源, 如果能收集雨水就好了...",XX
$book1_33_page2_1,,"Oh wait, we do! You can craft Rain Tanks to collect and store rainwater. Later on when you're all stocked up on honey we can combine the two and make some delicious Apicola!",XX,"Attends un peu... on peut la récupérer ! Tu peux fabriquer des réservoirs d'eau pour recueillir et stocker l'eau de pluie. Plus tard, quand tu auras fait le plein de miel, tu pourras combiner les deux et faire du délicieux apicola !","Oh, un attimo, ce l'abbiamo! Puoi fabbricare dei serbatoi d'acqua per raccogliere e conservare l'acqua piovana. Successivamente, quando avrai fatto scorta di miele, potremo combinare le due cose e realizzare della deliziosa Apicola!","Oh, warte, die haben wir! Du kannst Regentanks herstellen, um Regenwasser zu sammeln und aufzubewahren. Später, wenn du dich mit Honig eingedeckt hast, können wir beides kombinieren und köstliche Apicola herstellen!","¡Espera, sí podemos! Puedes crear tanques de lluvia para recoger y almacenar el agua de lluvia. Más tarde, cuando ya tengas mucha miel, ¡podremos combinar ambas para hacer deliciosa Apicola!","Pera lá, tem sim! Você pode criar Cisternas para coletar e armazenar água da chuva. Mais pra frente quando estiver com mel à beça, pode juntar os dois para fazer Apicola!",待って、あるよ！雨水タンクをクラフトしたら雨水をためて保管できる。そのうちハチミツがたくさん手に入るだろうから、雨水と合わせるとおいしいハチミツジルができるよ！,,,"等等, 我们确实可以啊! 你可以制造雨水缸来收集并储存雨水. 等你有了充足的蜂蜜, 就可以把两者结合起来做一做美味的蜂露啦!",XX
$book1_34_id,,Keep It Flowing,XX,Ça coule de source,Mantenere il flusso,Rumharzen,Que siga fluyendo,Mantendo o fluxo,流れをスムーズに,,,保持流动,XX
$book1_34_page1_1,,"Now you've been tapping these trees, you probably want to start collecting the resin somewhere!",XX,"Maintenant que tu as incisé ces arbres, tu veux probablement commencer à collecter de la résine !","Ora che stai sfruttando gli alberi, probabilmente vorrai iniziare a raccogliere la resina da qualche parte!","Jetzt, wo du diese Bäume angezapft hast, willst du wahrscheinlich irgendwo anfangen, das Harz zu sammeln!","Ahora que estuviste por todos lados poniéndoles grifos a los árboles, ¡seguro que quieres recoger resina en otra parte! ","Agora que você já furou algumas árvores, deve estar se interessando em pegar resinas de outros lugares!",木から樹脂を搾り取っているよね、どこかに集めたいと思っているんじゃない？,,,"这些树已经都榨取过了, 你可能想去其他地方收集树脂了吧!",XX
$book1_34_page1_2,,"You can craft canisters using Waterproof, which you can make from Lilypads that grow in the shallows.",XX,Il est possible de fabriquer des récipients à partir d'un matériau imperméable obtenable à partir de nénuphars qui poussent dans des eaux peu profondes.,"Puoi creare dei contenitori a partire dall'idrorepellente, che puoi realizzare usando le ninfee che crescono nelle acque poche profonde.","Du kannst Kanister aus wasserdichtem Material herstellen, das du aus Seerosenblättern gewinnen kannst, die im flachen Wasser wachsen.","Puedes crear latas con impermeabilizante, que puedes fabricar a partir de los nenúfares que crecen en aguas bajas.",Você pode criar galões usando Proteção Hídrica feita com Vitórias-régias que crescem em águas rasas.,防水材を使えば容器をクラフトできる。防水材は水辺に生息するスイレンの葉で作れるよ。,,,"你可以用防水材料制造罐子, 生长在浅水的睡莲就可以用来制作防水材料.",XX
$book1_34_page1_3,,Canisters are portable but can only hold a small amount of liquids. Barrels can't be moved but can hold much larger quantities!,XX,"Les récipients sont portables, mais ne peuvent contenir qu'une petite quantité de liquide. Les tonneaux ne peuvent pas être déplacés, mais peuvent contenir des quantités beaucoup plus importantes !","I contenitori sono portatili, ma possono trattenere solo una piccola quantità di liquido. I barili non si possono muovere, ma contengono quantità molto più ampie!","Kanister sind tragbar, können aber nur eine kleine Menge an Flüssigkeiten aufnehmen. Fässer können nicht transportiert werden, fassen aber viel größere Mengen!","Puedes llevar las latas a todas partes, pero cargan una pequeña cantidad de un líquido. Los barriles no se pueden mover, ¡pero tienen mucha más capacidad!","Galões são portáteis, mas só comportam pequenas quantidades de líquidos. Barris não podem ser movidos, mas armazenam quantidades muito maiores!",容器は持ち運べるけど、液体は少ししか入らない。樽は持ち運べないけど大量の液体を入れておける！,,,"罐子可以随身携带, 但只能装少量液体. 桶无法移动, 但可以储存大量液体!",XX
$book1_34_page2_1,,Be careful with your hammers though - a broken barrel will spill your precious fluids everywhere!,XX,"Cependant, attention avec tes marteaux : un tonneau fendu répandra ton précieux liquide partout !",Ma fai attenzione con i tuoi martelli - un barile rotto verserà i tuoi liquidi preziosi dappertutto!,Pass aber auf mit deinem Hammer - ein kaputtes Fass verschüttet seine kostbare Flüssigkeit überall!,"Eso sí, ten cuidado con los martillos: ¡un roto derramará tus preciadas sustancias por todo el lugar!",Mas tome cuidado com seus martelos - um barril quebrado vai derramar todos os seus preciosos fluídos!,ハンマーの扱いには気を付けて - 樽を壊しちゃうと大事な液体がそこら中にばらまかれるからね！,,,不过千万要小心你的锤子 - 砸破的桶会让你宝贵的液体流得到处都是.,XX
$book1_35_id,,Cold Infusion,XX,Infusion froide,Infusione a freddo,Was der Infusor kann,Infusión en frío,Infusão a frio,浸してみる,,,注入树脂,XX
$book1_35_page1_1,,At this point you're probably up to your ears in Resin so it's time we put it all to good use.,XX,"À ce stade, t'as probablement de quoi te faire un bain de résine. Il est donc temps de mettre tout ça à profit !","A questo punto probabilmente avrai resina che ti esce dalle orecchie, quindi è ora di metterla a frutto in qualche modo.","An diesem Punkt quillt dir das Harz vermutlich aus den Ohren. Es ist also an der Zeit, dass wir es für einen guten Zweck verwenden.","Seguro que, a esta altura, ya estás hasta las orejas de resina, así que será mejor que le demos un buen uso.","A essas horas você provavelmente tem Resina espalhada por todo canto, então é hora de usar ela.",そろそろ樹脂があふれるほど採れたと思うから、使ってみようか。,,,"现在你应该已经对树脂有了一定的了解, 接下来我们就可以让它发挥应有的作用啦.",XX
$book1_35_page1_2,,"By infusing your wood with Resin you can make it stronger and more versatile, meaning you can make more improved items.",XX,"En infusant ton bois avec de la résine, tu peux le rendre plus solide et plus souple, te permettant de créer des objets plus performants.","Infondendo il tuo legno con la resina puoi renderlo più forte e versatile, il che significa poter realizzare oggetti sempre migliori.","Indem du dein Holz im Infusor mit Harz durchtränkst, kannst du es stärker und vielseitiger machen. Das bedeutet, dass du mehr verbesserte Gegenstände herstellen kannst.","Al infusionar la madera con resina, la harás mucho más fuerte y versátil, lo que significa objetos mejorados.","Ao infundir madeira com Resina você pode fortificá-la e deixá-la mais versátil, o que significa que poderá fazer itens melhores.",木材を樹脂に浸すとより丈夫になり使い勝手も良くなる。つまりレベルの高いアイテムを作れるんだ。,,,"注入树脂后的木材更强韧, 用途也更丰富, 这就意味着你可以用它制作更高级的物品.",XX
$book1_35_page1_3,,"To get started you'll need to craft yourself an Infuser, which uses Resin to infuse planks and sticks.",XX,"Pour commencer, tu vas devoir fabriquer un infuseur. Il utilise de la résine pour infuser les planches et les tiges.","Per iniziare, dovrai creare un infusore, che usa la resina per infondere assi e bastoncini.","Um loszulegen, musst du dir einen Infusor bauen, der Harz zum Aufgießen von Brettern und Stöcken verwendet.","Para empezar, deberás crear un infusionador, que usa resina para infusionar tablas y varas.","Para começar, você precisar criar um Infusor, que usa Resina para infundir tábuas e varas.",まずは板や棒を樹脂で浸すためのインフューザーをクラフトしよう。,,,"首先你需要给自己制造一个注入器, 它可以将树脂注入木板和木棍.",XX
$book1_35_page2_1,,Think of it like when you take a nice sticky bath! What do you mean you don't do that?,XX,"Pratique, non ? Par contre je pense pas que ça fonctionne sur les humains.",Pensaci bene quando fai un bel bagno appiccicoso! Aspetta... che vuol dire che non ne fai?,"Stell dir vor, du nimmst ein schönes, klebriges Bad! Was soll das heißen, sowas machst du nicht?","Para que te des una idea, ¡es como cuando te das un buen baño pegajoso! ¿Qué? ¿Cómo que no haces eso?",Pense que é como tomar um relaxante banho grudento! Como assim você não faz isso?,素敵なベトベト風呂だよ！入りたくないってどういうこと？,,,就像泡黏黏澡一样! 你说你没泡过是什么意思?,XX
$book1_36_id,,Getting An Upgrade,XX,Le temps est à l'amélioration,Potenziamenti,Besser als gut,Obtener mejoras,Melhoria de Vida,アップグレード,,,升级设备,XX
$book1_36_page1_1,,"Now we've treated our wood we can treat ourselves! With infused wood you can craft upgrades for most of your machines and, more importantly, your apiaries.",XX,"Maintenant que tu as traité ton bois, il est temps de se faire plaisir ! Grâce au bois infusé, tu peux fabriquer des améliorations pour la plupart de tes machines et, surtout, de tes ruchers.","Ora che abbiamo trattato il legno, è tempo di curarsi un po'! Con del legno infuso, puoi fabbricare dei potenziamenti per molte delle tue macchine e, soprattutto, per i tuoi apiari.","Jetzt, wo wir unser Holz behandelt haben, können wir uns auch mal was gönnen! Mit behandeltem Holz kannst du die meisten deiner Maschinen und vor allem deine Bienenstöcke aufwerten.","Ahora que ya mejoramos la madera, ¡podemos mejorar nuestras vidas! Con la madera infusionada, puedes crear mejoras para la mayoría de tus máquinas y los apiarios.","Agora que você cuidou da sua madeira, é hora de cuidarmos de nós mesmos! Com madeira infundida você pode criar melhorias para a maioria das suas máquinas, e acima de tudo, para seus apiários.",これからお世話になる木のお世話ができたね！加工した木材を使えば機械をアップグレードできるよ。しかもね、養蜂場もできるんだ！,,,"现在我们已经处理完木材, 可以好好奖励一下自己啦! 有了注脂木材, 你可以升级你的大部分机器, 最重要的是可以升级你的养蜂场.",XX
$book1_36_page1_2,,Advanced Apiaries,XX,Ruchers avancés,Apiari avanzati,Fortgeschrittene Bienenstöcke,Apiarios avanzados,Apiários Avançados,優れた養蜂場,,,高级养蜂场,XX
