KEY,NOTES_FOR_LOCALISATION,LINE_EN,LINE_XX,LINE_FR,LINE_IT,LINE_DE,LINE_ES,LINE_BP,LINE_JP,LINE_RU,LINE_KP,LINE_CN,LINE_XX
$book1_9_page2_1,,"Placed tiles and walls will automatically snap to the grid, and you can hold down ◆ to place multiple at once.",XX,Les carreaux et les murs placés s'accrochent automatiquement à la grille. Tu peux en placer plusieurs à la fois en maintenant ◆ enfoncé.,Piastrelle e mure si adatteranno automaticamente alla griglia. Puoi tenere premuto ◆ per posizionare diversi elementi contemporaneamente.,"Die platzierten Fliesen und Wände rasten automatisch am Raster ein, und du kannst ◆ gedrückt halten, um mehrere auf einmal zu platzieren.",Las baldosas y las paredes se adaptarán automáticamente a la cuadrícula. También puedes mantener ◆ para colocar varias a la vez.,"Pisos e paredes irão se ajustar à grade automaticamente, e você pode segurar ◆ para colocar vários de uma vez.",設置されたタイルや壁は自動でグリッドにスナップされる。一度に複数を設置するには◆を長押ししよう。,,,"放置的地块和墙壁会自动对齐到方格, 你可以按住◆来一次性放置多个.",XX
$book1_9_page2_2,,If you make a mistake you can use a hammer to pick it back up again!,XX,"Si tu fais une erreur, tu peux utiliser un marteau pour récupérer ce que tu as posé !","Se fai un errore, puoi usare un martello per recuperare il materiale!","Wenn du dich verbaust, hilft ein Hammer beim Aufheben!","Si te equivocas, ¡puedes usar el martillo para volver a recoger el material!","Se cometer um erro, pode usar o martelo para pegar o item de volta!",間違えてしまってもハンマーを使えばもう一度拾うことができる！,,,"如果不小心放错了, 你可以用锤子把它敲下重新拾起!",XX
$book1_9_page2_gp1,,"Placed tiles and walls will automatically snap to the grid. You can use ② or ⑬+⑮ to force a direction, and hold down ③ to place multiple at once.",XX,Les planchers et les murs placés s'accrochent automatiquement à la grille. Tu peux en placer plusieurs à la fois en maintenant ③ enfoncé.,Piastrelle e mure si adatteranno automaticamente alla griglia. Puoi tenere premuto ③ per posizionare diversi elementi contemporaneamente.,"Die platzierten Fliesen und Wände rasten automatisch am Raster ein, und du kannst ③ gedrückt halten, um mehrere auf einmal zu platzieren.",Las baldosas y las paredes se adaptarán automáticamente a la cuadrícula. También puedes mantener ③ para colocar varias a la vez.,"Pisos e paredes irão se ajustar à grade automaticamente, e você pode segurar ③ para colocar vários de uma vez.",設置されたタイルや壁は自動でグリッドにスナップされる。一度に複数を設置するには③を長押ししよう。,,,"放置的地块和墙壁会自动对齐到方格, 你可以按住③来一次性放置多个.",XX
$book1_10_id,,Paint The Town,XX,Les goûts et les couleurs,Colori in corso,Die Stadt anmalen,Pinta el pueblo,Ao vivo e em cores,街の塗装,,,粉刷小镇,XX
$book1_10_page1_1,,"So you've built yourself a cute little house (or decided to embrace that #ForestHermit life, no judgement here!)",XX,Tu t'es construit une jolie petite bicoque. (Ou décidé d'embrasser la vie de druide. Je suis personne pour juger !),"Allora, finalmente hai costruito una bella casetta. (O hai deciso di abbracciare una vita da #Eremitadellaforesta, nessun giudizio!)","Du hast dir also ein hübsches kleines Haus gebaut (oder dich für das #WaldeinsiedlerLeben entschieden, ich bewerte das nicht!)","¡Conque te construiste una bonita casita! (O quizás decidiste ir por la #VidaErmitaña, ¡aquí no juzgamos a nadie!).","Você conseguiu construir sua casinha fofa (ou decidiu aceitar a vida de #ErmitãoDaFloresta, e está tudo bem!)",小さくて愛おしいおうちができた頃かな（#森の隠居生活 を楽しむならそれでいいけどね、否定はしないよ！）,,,"你已经建好自己可爱的小家(或是享受#隐居森林 的生活, 我们也完全没意见!)",XX
$book1_10_page1_2,,Now wouldn't it just be sweet as honey if you could paint that lil house or color code your storage?,XX,Ne serait-ce pas merveilleux si tu pouvais peindre ta maison ou ajouter des codes couleur à tes rangements ?,Non sarebbe dolce come il miele se potessi colorare il tuo bel rifugio o evidenziare le tue cose con dei colori diversi?,"Wäre es nicht süß wie Honig, wenn du das kleine Haus streichen oder dein Lager farblich kennzeichnen könntest?",¿No serías más feliz que abeja con doce patas si pudieras pintar esa casita o usar colores para identificar tus distintos puntos de almacenamiento?,Agora não seria doce como o mel se você pudesse pintar sua casinha ou criar identificações por cor do seu armazém?,かわいいおうちや木箱を塗装できたらハチミツみたいに魅力的だと思わない？,,,"想象一下, 如果能把你的小房子粉刷一下, 或是给储物箱配上不同颜色, 会不会感觉相当甜蜜呢?",XX
$book1_10_page2_1,,"Well, good news! You can craft Dyes using flowers and glue, and use a Paintbrush to paint any tile, wall, or object any colour you like!",XX,"Eh bien, bonne nouvelle ! Tu peux fabriquer des teintures en utilisant des fleurs et de la colle, et utiliser un pinceau pour peindre n'importe quel plancher, mur ou objet de la couleur de ton choix !","Beh, buone notizie! Ora puoi fabbricare delle vernici usando fiori e colla e usare un pennello per verniciare con il tuo colore preferito qualsiasi mattonella, muro o oggetto!","Nun, gute Nachrichten! Du kannst mit Blumen und Klebstoff Farben herstellen und mit einem Farbroller jede Fliese, Wand oder jeden Gegenstand in einer beliebigen Farbe anmalen!","¡Tenemos buenas noticias! Puedes crear pinturas con flores y pegamento y, con el pincel, ¡podrás pintar cualquier baldosa, pared u objeto del color que más te guste!","Tenho boas notícias! Você pode criar Tinturas usando flores e cola, e usar um Rolo de pintura para pintar qualquer piso, parede ou objeto, da cor que você quiser!",良い知らせだよ！花やのりを使うと染料をクラフトできた、筆を使うとタイルや壁、色んなものに好きな色を付けられるよ！,,,"告诉你一个好消息! 你可以用花朵和胶水来制造染料, 然后用刷子把任意地块, 墙壁和物体涂画成你喜欢的颜色!",XX
$book1_10_page2_2,,If you decide you want a change of scenery you can craft a Scraper to remove it.,XX,"Si tu décides de changer d'air, tu peux utiliser un racloir pour retirer la peinture.","Se per caso hai cambiato idea, puoi usare un raschietto per rimuovere la vernice.","Wenn du dich für einen Tapetenwechsel entscheidest, kannst du einen Kratzer verwenden, um Farbe zu entfernen","Si más tarde decides que quieres cambiar un poco las cosas, puedes crear una espátula para quitar la pintura.","Se você enjoou e quer mudar a estética, é só criar um Raspador para removê-las.",雰囲気を変えたいと思ったら、スクレーパーで色を落とせるよ。,,,"如果你想要换个环境, 可以造一把刮刀来移除染料.",XX
$book1_11_id,,Like Clockwork,XX,Réglé comme une horloge,Come un ingranaggio,Wie ein Uhrwerk,Como un relojito,Engrenagens da Vida,ぜんまいじかけの機械,,,发条机器,XX
$book1_11_page1_1,,"As well as upgrading our apiaries, we can now upgrade all our machines to save our poor calloused hands from all that manual labour!",XX,"En plus de moderniser nos ruchers, on peut maintenant moderniser toutes nos machines pour épargner à nos pauvres mimines tout ce travail manuel !","Oltre a migliorare i tuoi alveari, puoi aggiornare anche tutte le tue macchine per risparmiare tutto quel lavoro manuale alle tue povere mani piene di calli!","Wir können nicht nur unsere Bienenstöcke aufrüsten, sondern auch alle unsere Maschinen, um unsere armen, schwieligen Hände von all der Handarbeit zu entlasten!","Además de mejorar nuestros apiarios, ¡también podemos mejorar todas nuestras máquinas para ahorrarles un poco de trabajo a esas manos callosas!","Além de melhorar nossos apiários, agora podemos melhorar nossas máquinas, para poupar nossas pobres mãos calejadas de mais trabalho manual!",養蜂場もアップグレードできるけれど、機械だってアップグレードできるんだ。作業のしすぎで手にできちゃったタコとはもうおさらばだ！,,,"除了升级养蜂场以外, 我们现在可以升级所有机器来把我们满是老茧的手从体力活中解放出来!",XX
$book1_11_page1_2,,Using Glue made from Propolis and infused sticks we can make Cogs.,XX,"En utilisant de la colle à base de propolis et des tiges infusées, il est possible de fabriquer des rouages.","Usando la colla ottenuta dalla propoli e dei bastoncini infusi, puoi realizzare delle ruote dentate.",Mit Klebstoff aus Propolis und Stöcken aus dem Infusor können wir Zahnräder herstellen.,"Con un poco de pegamento hecho a base de propóleo y varas infusionadas, podemos hacer engranajes.","Usando Cola feita com Própolis e varas infundidas, podemos criar Engrenagens.",プロポリスからできたのりと強化された木の棒を使って歯車を作ることができる。,,,我们可以把蜂胶制成的胶水和注脂木棍做成发条.,XX
$book1_11_page1_3,,With cogs we can start making semi-automatic Clockwork Machines,XX,"Avec ces rouages, on peut commencer à fabriquer des machines semi-automatiques.","Con esse, possiamo iniziare a fabbricare delle macchine a ingranaggio semi-automatiche.",Mit Zahnrädern können wir halbautomatische Uhrwerkmaschinen herstellen,Los engranajes nos permitirán fabricar máquinas semiautomáticas con mecanismos.,Com engrenagens podemos criar Máquinas de Engrenagens semiautomáticas.,歯車を使えば半自動のぜんまいじかけの機械が作れる,,,"有了发条, 我们就可以开始制造半自动发条机器了",XX
$book1_11_page2_1,,All you have to do with clockwork machines is wind them up and watch them go!,XX,"Tout ce que tu as à faire avec les machines semi-automatiques, c'est de les remonter et de les regarder se mettre au travail à ta place !",Tutto quello che devi fare con queste macchine a ingranaggio è caricarle e vederle lavorare!,"Alles, was man bei einem Uhrwerk tun muss, ist, es aufzuziehen und zu beobachten, wie es läuft!",Lo único que tienes que hacer es darles cuerda a las máquinas ¡y disfrutar de su trabajo!,Tudo o que precisa fazer com as máquinas de engrenagem é dar corda e elas fazem o resto sozinhas!,ぜんまいじかけの機械を動かすには取っ手を巻き上げて、あとは見ているだけ！,,,"你要做的就是上好发条, 然后看着它们工作就行啦!",XX
$book1_11_page2_2,,Let's start by upgrading your Sawbench into a Sawmill.,XX,Commençons par transformer ton banc de scie en scierie.,Iniziamo trasformando il tuo banco sega in una segheria.,Beginnen wir mit der Aufrüstung deiner Sägebank zu einem Sägewerk.,Empecemos por mejorar nuestra sierra a un aserradero.,Vamos começar atualizando sua Serra de mesa para uma Serraria.,ノコ台を製材機にアップグレードしてみよう。,,,我们先来把你的锯床升级成锯木机.,XX
$book1_12_id,,Sweet To The Core,XX,Quand il gèle à pierre fendre,Dolce come il Cristalmiele,Süß bis ins Mark,Dulce hasta la médula,Doce como Cristamel,コアまで甘い,,,甜到核心,XX
$book1_12_page1_1,,Honeycore is a strange crystal - it vibrates when there are active hives nearby.,XX,La miellite est un cristal plus qu'étrange. Il vibre lorsqu'il y a des ruches actives à proximité.,Il Cristalmiele è uno strano cristallo - vibra quando ci sono degli alveari attivi nelle vicinanze.,"Honigkern ist ein seltsamer Kristall - er vibriert, wenn aktive Bienenstöcke in der Nähe sind.",La mielita es un cristal extraño: vibra cuando hay colmenas activas cerca.,Cristamel é um cristal estranho - ele vibra quando está perto de colmeias ativas.,ハニーコアは不思議な結晶 - 稼働中の巣が近くにあると振動するんだ。,,,"蜜核是一种神奇的水晶 - 当附近有活蜂巢时, 它就会震动.",XX
$book1_12_page1_2,,"Out in the Tundra, Bobbee has been working on ways to create Honeycore machines that harness the power of bees!",XX,"Dans la toundra, Samiel cherche à créer des machines à à base de miellite qui exploitent le pouvoir des abeilles !","Nella tundra, Apessandro sta lavorando su dei modi per creare delle macchine di Cristalmiele che possano sfruttare la potenza delle api!","Draußen in der Tundra hat Bienedikt an der Entwicklung von Honigkern-Maschinen gearbeitet, die die Kraft der Bienen nutzbar machen!","Allí en la tundra, ¡Poleny estuvo trabajando en nuevas máquinas de mielita que aprovechen el poder de las abejas!","Na Tundra, Bel tem se esforçado para criar máquinas de Cristamel que usam o poder das abelhas!",ツンドラではハチ郎が、ハチの力を利用するハニーコアの機械を製作している。,,,位于苔原的鲍蜜一直在努力研究利用蜜蜂力量的蜜核机器!,XX
$book1_12_page2_1,,"If you mine some of the Honeycore crystals that you come across, you'll be able to trade them with Bobbee for some of their prototypes",XX,"Si tu exploites les cristaux de miellite que tu trouves, tu pourras les échanger avec Samiel contre certains de ses prototypes.","Se estrai i cristalli di Cristalmiele che incontrerai sul tuo cammino, potrai darli ad Apessandro in cambio dei suoi prototipi.","Wenn du einige der Honigkern-Kristalle abbaust, die du findest, kannst du sie bei Bienedikt gegen Prototypen eintauschen","Si extraes algunos de los cristales de mielita que te encuentres, podrás intercambiárselos a Poleny por algunos de sus prototipos.","Se você minerar alguns Cristaméis que encontrar, você pode trocá-los por alguns protótipos de Bel.",ハニーコアの結晶を採掘できたときは、ハチ郎のところへ行けば機械の原型と交換してくれる,,,"如果你挖到蜜核水晶, 可以卖给鲍蜜来换取原型机",XX
$book1_13_id,,Menu Magic,XX,Magie de l'interface,La magia dei menu,Menü-Magie,La magia de los menús,Magia dos menus,メニューの操作,,,神奇菜单,XX
$book1_13_page1_1,,"As you might have realised by now, there's a lot of menus in this game!",XX,Tu as sans doute remarqué qu'il y a beaucoup de menus dans ce jeu !,"Come ormai avrai capito, ci sono tantissimi menu in questo gioco!","Wie du vielleicht schon bemerkt hast, gibt es in diesem Spiel eine Menge Menüs!","Como ya te habrás dado cuenta, ¡este juego cuenta con un montón de menús!",Você deve ter percebido que esse jogo tem muitos menus!,もう気づいているだろうけど、このゲームにはメニューがたくさんある！,,,"你应该也发现了, 游戏中有非常多的菜单!",XX
$book1_13_page1_2,,"If you're unsure what a menu is, or what you can do with it, just press the ★ button for some handy hints!",XX,"Si tu veux en savoir plus sur un menu, appuie simplement sur ★ pour obtenir des conseils pratiques !","Se non sai che menu stai visualizzando, o quale sia il suo scopo, premi il pulsante ★ per ottenere dei consigli pratici!","Wenn du dir nicht sicher bist, was ein Menü genau beschreibt oder was du damit machen kannst, drücke einfach die Taste ★, um einige praktische Hinweise zu erhalten!","Si no tienes muy en claro qué hace un menú, ¡tan solo oprime el botón ★ para obtener algunas pistas!","Se não souber o que um menu é, ou o que fazer com ele, é só apertar o botão ★ para pegar algumas dicas!",何のメニューか分からないとか、何ができるか分からないときには★ボタンでヒントを見てみよう！,,,"如果你不确定某个菜单是什么, 或者不知道该怎么使用, 只要按★按钮就能获得便利的提示!",XX
$book1_13_page1_gp2,,"If you're unsure what a menu is, or what you can do with it, just press the ⑥ button for some handy hints!",XX,"Si tu veux en savoir plus sur un menu, appuie simplement sur ⑥ pour obtenir des conseils pratiques !","Se non sai che menu stai visualizzando, o quale sia il suo scopo, premi il pulsante ⑥ per ottenere dei consigli pratici!","Wenn du dir nicht sicher bist, was ein Menü genau beschreibt oder was du damit machen kannst, drücke einfach die Taste ⑥, um einige praktische Hinweise zu erhalten!","Si no tienes muy en claro qué hace un menú, ¡tan solo oprime el botón ⑥ para obtener algunas pistas!","Se não souber o que um menu é, ou o que fazer com ele, é só apertar o botão ⑥ para pegar algumas dicas!",何のメニューか分からないとか、何ができるか分からないときには⑥ボタンでヒントを見てみよう！,,,"如果你不确定某个菜单是什么, 或者不知道该怎么使用, 只要按⑥按钮就能获得便利的提示!",XX
$book1_13_page2_1,,You can move any open menus by dragging the top menu 'bar'!,XX,Tu peux déplacer tous les menus ouverts en faisant glisser la barre du menu supérieur !,Puoi spostare qualsiasi menu aperto trascinando la barra superiore del menu!,Du kannst alle geöffneten Menüs durch Ziehen der oberen Menüleiste verschieben!,¡Puedes mover cualquier menú abierto arrastrándolo desde la 'barra' de menú superior!,Você pode mover qualquer menu aberto arrastando a 'barra' no topo do menu!,上部のメニュー「バー」をドラッグすれば開いたメニューを動かすことができるよ！,,,只要拖动顶部的菜单'栏'就可以移动任意菜单!,XX
$book1_13_page2_2,,"Menus will stay open until you close them, or get too far away from them. They just miss you so much you see!",XX,"Les menus resteront ouverts jusqu'à ce que tu les fermes, ou que tu t'en éloignes trop. Tu leur manques tant, tu vois !",I menu resteranno aperti fin quando non li chiuderai o ti allontanerai troppo. Moriranno di malinconia a non vederti!,"Die Menüs bleiben so lange geöffnet, bis du sie schließt oder dich zu weit von ihnen entfernst. Sie vermissen dich dann einfach so sehr, weißt du?",Los menús se quedarán abiertos hasta que los cierres o te alejes lo suficiente de ellos. ¿Ves? ¡Te extrañan tanto!,"Menus ficarão abertos até que os feche, ou se afaste demais deles. Eles morrem de saudades!",メニューはキミが閉じるか遠くへ行くまで開いたままだよ。キミって好かれてるね！,,,"除非你手动关闭, 或是距离太远, 菜单将会一直保持打开的状态. 你看它们多牵挂你!",XX
$book1_13_page2_gp1,,Whenever a menu is opened your inventory will automatically open too.,XX,"Chaque fois qu'un menu est ouvert, ton inventaire s'ouvre automatiquement.","Ogni qual volta viene aperto un menu, si apre automaticamente anche il tuo inventario.","Immer wenn ein Menü geöffnet wird, öffnet sich automatisch auch dein Inventar.","Cuando se abra un menú, tu inventario también se abrirá automáticamente.","Sempre que um menu for aberto, seu inventário também abrirá.",メニューを開くと自動的にインベントリも開くよ。,,,"每当打开一个菜单, 你的物品栏也会自动打开.",XX
$book1_13_page2_gp2,,"To close a menu press ④, any item still picked up will be dropped on the floor!",XX,"Pour fermer un menu, appuie sur ④. Tout élément ramassé se rangera !",Per chiudere un menu premi ④. Tutti gli oggetti raccolti verranno riposti in automatico!,"Um ein Menü zu schließen, drücke ④. Jeder Gegenstand, den du noch aufnimmst, wird wieder eingepackt!","Para cerrar un menú, oprime ④. ¡Cualquier objeto que tengas en las manos volverá a su lugar!","Para fechar um menu aperte ④, qualquer item estiver segurando será devolvido!",④を押すとメニューが閉じて、拾ったアイテムは自動で戻るよ！,,,"按④可以关闭一个菜单, 拿取中的任意物品都会自动返回!",XX
$book1_14_id,,Advanced Controls,XX,Commandes avancées,Controlli avanzati,Erweiterte Steuerung,Controles avanzados,Controles Avançados,その他の操作,,,进阶操作,XX
$book1_14_page1_1,,"At this point you're probably sick of moving things one by one, if only there was a quicker way to move stuff around?",XX,"À ce stade, tu en as probablement assez vous déplacer sur les objets un par un. Si seulement il y avait un moyen plus rapide de les déplacer...",A questo punto non ne potrai sicuramente più di spostare sulle cose una a una. Se solo ci fosse un modo più rapido per spostare le cose...,"Wahrscheinlich hast du es inzwischen satt, alles einzeln zu verschieben Wenn es doch nur einen schnelleren Weg gäbe, Dinge zu verschieben...","Seguro que, a esta altura, ya te cansaste un poco de hacer de mover cada cosita, una por una... ¿Y si hubiera una forma más rápida de mover los objetos?","A essa altura, você provavelmente não aguenta mais mexer em cada coisinha. Não seria ótimo se tivesse um jeito mais rápido de mover as coisas?",一つずつ動かすのは疲れませんか？もっと効率がいい方法はないのかな？,,,到现在你应该已经对于一个一个搬运东西感到厌烦了吧? 如果能有更快的方法来移动东西有多好?,XX
$book1_14_page1_2,,"Luckily for you, there is! When any two menus are open you can use ▤ while clicking with ◆ to move that stack to the other menu.",XX,"Heureusement pour toi, il y en a un ! Lorsque deux menus sont ouverts, tu peux utiliser ▤ tout en cliquant avec ◆ pour déplacer la pile vers l'autre menu.","Per tua fortuna, c'è, eccome! Quando hai due menu aperti, puoi usare ▤ mentre clicchi con ◆ per spostare quella pila nell'altro menu.","Zu deinem Glück gibt es den! Wenn zwei beliebige Menüs geöffnet sind, kannst du ▤ verwenden, während du mit ◆ klickst, um den Stapel in das andere Menü zu verschieben.","¡Estás de suerte, porque tal cosa existe! Cuando haya dos menús abiertos, puedes usar ▤ mientras haces clic con ◆ para mover esa pila al otro menú.",Sorte a sua que existe! Quando dois menus estão abertos você pode usar ▤ enquanto clica com ◆ para mover a pilha para o outro menu.,そんなキミに朗報だよ！メニューが2つ以上開いているときには◆でクリックしながら▤を使ってそのスタックを別のメニュー内に移動させることができる。,,,"真的有喔! 打开两个菜单时, 你可以按▤, 同时用◆点击来把一堆物品移动到另一个菜单.",XX
$book1_14_page1_gp2,,"Luckily for you, there is! When a menu is open you can use ⑤ on a slot to move that item to the other menu.",XX,"Heureusement pour toi, il y en a un ! Lorsque deux menus sont ouverts, tu peux utiliser ▤ sur un emplacement pour déplacer l'objet vers l'autre menu.","Per tua fortuna, c'è, eccome! Quando hai due menu aperti, puoi usare ⑤ per spostare quell'oggetto nell'altro menu.","Zu deinem Glück gibt es den! Wenn ein Menü geöffnet ist, kannst du ⑤ in einen Bereich klickst, um diesen Eintrag in das andere Menü zu verschieben.","¡Estás de suerte, porque tal cosa existe! Cuando haya un menú abierto, puedes usar ⑤ en un espacio para mover ese objeto al otro menú.",Sorte a sua que existe! Quando um menu está aberto você pode usar ⑤ em um espaço para mover aquele item para outro menu.,そんなキミに朗報だよ！メニューが開いているときにはスロットを押しながら⑤を使ってそのアイテムを別のメニュー内に移動させることができる。,,,"告诉你一个好消息! 打开一个菜单时, 你可以对一个槽位使用⑤来把物品移动到另一个菜单.",XX
$book1_14_page2_1,,"If you have more than two menus open, you can use the ◘ button to set that menu as the 'target'.",XX,"Si tu as plus de deux menus ouverts, tu peux utiliser le bouton ◘ pour définir un menu comme « cible ».","Se hai più di due menu aperti, puoi usare il pulsante ◘ per impostare quel menu come 'obiettivo'.","Wenn du mehr als zwei Menüs offen hast, kannst du mit ◘ dieses Menü als 'Ziel' festlegen.","Si tienes más de dos menús abiertos, puedes usar el botón ◘ para establecer ese menú como el 'objetivo'.","Se você tiver mais do que dois menus abertos, pode usar o botão ◘ para definir aquele menu como 'alvo'.",メニューが2つ以上開いているときには◘ボタンを使って1つのメニューを操作対象にしよう。,,,"如果你打开了两个以上的菜单, 可以用◘按钮来将该菜单设置为'目标'.",XX
$book1_14_page2_2,,"All ▤ clicked items will be yeeted over to the target menu, wee!",XX,"Tous les objets cliqués ▤ seront transférés vers le menu cible, youhou !","Tutti gli oggetti su cui hai fatto clic con ▤ saranno trasferiti verso il menu obiettivo, wee!","Alle ▤ angeklickten Elemente werden in das Zielmenü verschoben, wohoo!",Todos los objetos en los que hagas clic con ▤ se enviarán al menú objetivo. ¡Yujuuu!,"Todos os itens clicados ▤ com serão lançados para o menu alvo, voosh!",▤クリックされたアイテムを操作対象のメニューにまとめて移動できる。やったね！,,,"所有按▤点击的物品都会被传送到目标菜单, 神奇吧!",XX
